{
  "schema_version": "1.0.0",
  "meta": {
    "date": "2026-06-24",
    "run_ts_utc": "2026-06-24T16:25:37Z",
    "config_hash": "1e9ad7396383",
    "vol_model": "ewma",
    "percentile_window": "3y",
    "fpr_control": "fdr",
    "calm_morning": true,
    "degraded_sources": [
      "move_delayed_example_degraded"
    ]
  },
  "composites": {
    "ofr_fsi": {
      "value": -0.4,
      "level_pct": 100.0,
      "change_score": 2.121046,
      "color": "amber",
      "staleness": {
        "asof": "2026-06-20",
        "lag_desc": "OFR 2-bd lag",
        "is_stale": false
      },
      "history": [
        {
          "date": "2026-06-16",
          "value": -1.1
        },
        {
          "date": "2026-06-17",
          "value": -1.05
        },
        {
          "date": "2026-06-18",
          "value": -0.98
        },
        {
          "date": "2026-06-19",
          "value": -0.9
        },
        {
          "date": "2026-06-20",
          "value": -0.4
        }
      ]
    },
    "nfci": {
      "value": -0.45,
      "level_pct": 100.0,
      "change_score": 1.816252,
      "color": "green",
      "staleness": {
        "asof": "2026-06-20",
        "lag_desc": "NFCI weekly",
        "is_stale": false
      },
      "history": [
        {
          "date": "2026-05-23",
          "value": -0.55
        },
        {
          "date": "2026-05-30",
          "value": -0.54
        },
        {
          "date": "2026-06-06",
          "value": -0.52
        },
        {
          "date": "2026-06-13",
          "value": -0.5
        },
        {
          "date": "2026-06-20",
          "value": -0.45
        }
      ]
    },
    "anfci": {
      "value": -0.18,
      "level_pct": 100.0,
      "change_score": 2.07358,
      "color": "amber",
      "staleness": {
        "asof": "2026-06-20",
        "lag_desc": "NFCI weekly",
        "is_stale": false
      },
      "history": [
        {
          "date": "2026-05-23",
          "value": -0.3
        },
        {
          "date": "2026-05-30",
          "value": -0.29
        },
        {
          "date": "2026-06-06",
          "value": -0.28
        },
        {
          "date": "2026-06-13",
          "value": -0.26
        },
        {
          "date": "2026-06-20",
          "value": -0.18
        }
      ]
    }
  },
  "tiles": [
    {
      "key": "ofr_fsi",
      "axis": 0,
      "label": "OFR FSI",
      "source": "ofr:fsi",
      "value": -0.4,
      "change": 0.5,
      "transform": "first_diff",
      "ewma_z": 2.121046,
      "pct_1y": 100.0,
      "pct_3y": 100.0,
      "level_pct_756": 100.0,
      "robust_z": 19.110833,
      "color": "amber",
      "staleness": {
        "asof": "2026-06-20",
        "lag_desc": "OFR 2-bd lag",
        "is_stale": false
      },
      "history": [
        {
          "date": "2026-06-16",
          "value": -1.1
        },
        {
          "date": "2026-06-17",
          "value": -1.05
        },
        {
          "date": "2026-06-18",
          "value": -0.98
        },
        {
          "date": "2026-06-19",
          "value": -0.9
        },
        {
          "date": "2026-06-20",
          "value": -0.4
        }
      ],
      "is_front_screen": true,
      "note": "composite anchor; daily, 2-bd lag"
    },
    {
      "key": "nfci",
      "axis": 0,
      "label": "Chicago Fed NFCI",
      "source": "fred:NFCI",
      "value": -0.45,
      "change": 0.05,
      "transform": "first_diff",
      "ewma_z": 1.816252,
      "pct_1y": 100.0,
      "pct_3y": 100.0,
      "level_pct_756": 100.0,
      "robust_z": 4.047,
      "color": "green",
      "staleness": {
        "asof": "2026-06-20",
        "lag_desc": "NFCI weekly",
        "is_stale": false
      },
      "history": [
        {
          "date": "2026-05-23",
          "value": -0.55
        },
        {
          "date": "2026-05-30",
          "value": -0.54
        },
        {
          "date": "2026-06-06",
          "value": -0.52
        },
        {
          "date": "2026-06-13",
          "value": -0.5
        },
        {
          "date": "2026-06-20",
          "value": -0.45
        }
      ],
      "is_front_screen": true,
      "note": "weekly composite"
    },
    {
      "key": "anfci",
      "axis": 0,
      "label": "Chicago Fed ANFCI",
      "source": "fred:ANFCI",
      "value": -0.18,
      "change": 0.08,
      "transform": "first_diff",
      "ewma_z": 2.07358,
      "pct_1y": 100.0,
      "pct_3y": 100.0,
      "level_pct_756": 100.0,
      "robust_z": 8.7685,
      "color": "amber",
      "staleness": {
        "asof": "2026-06-20",
        "lag_desc": "NFCI weekly",
        "is_stale": false
      },
      "history": [
        {
          "date": "2026-05-23",
          "value": -0.3
        },
        {
          "date": "2026-05-30",
          "value": -0.29
        },
        {
          "date": "2026-06-06",
          "value": -0.28
        },
        {
          "date": "2026-06-13",
          "value": -0.26
        },
        {
          "date": "2026-06-20",
          "value": -0.18
        }
      ],
      "is_front_screen": false,
      "note": "adjusted NFCI; weekly composite; detect-on-composites anchor"
    },
    {
      "key": "stlfsi4",
      "axis": 0,
      "label": "St. Louis Fed FSI (STLFSI4)",
      "source": "fred:STLFSI4",
      "value": null,
      "change": null,
      "transform": "first_diff",
      "ewma_z": null,
      "pct_1y": null,
      "pct_3y": null,
      "level_pct_756": null,
      "robust_z": null,
      "color": "gray",
      "staleness": {
        "asof": null,
        "lag_desc": "no data",
        "is_stale": true
      },
      "history": [],
      "is_front_screen": false,
      "note": "weekly composite; reserved freshness window, optional anchor"
    },
    {
      "key": "spx",
      "axis": 1,
      "label": "S&P 500 / ES",
      "source": "yfinance:ES=F",
      "value": 5930.0,
      "change": -0.010902,
      "transform": "log_return",
      "ewma_z": -1.955818,
      "pct_1y": 100.0,
      "pct_3y": 100.0,
      "level_pct_756": 20.0,
      "robust_z": -2.036032,
      "color": "green",
      "staleness": {
        "asof": "2026-06-23",
        "lag_desc": "EOD delayed",
        "is_stale": false
      },
      "history": [
        {
          "date": "2026-06-17",
          "value": 5980.0
        },
        {
          "date": "2026-06-18",
          "value": 6005.0
        },
        {
          "date": "2026-06-19",
          "value": 6010.0
        },
        {
          "date": "2026-06-20",
          "value": 5995.0
        },
        {
          "date": "2026-06-23",
          "value": 5930.0
        }
      ],
      "is_front_screen": true,
      "note": null
    },
    {
      "key": "vix",
      "axis": 1,
      "label": "VIX",
      "source": "yfinance:^VIX",
      "value": 18.6,
      "change": 4.2,
      "transform": "first_diff",
      "ewma_z": 2.155833,
      "pct_1y": 100.0,
      "pct_3y": 100.0,
      "level_pct_756": 100.0,
      "robust_z": 6.323437,
      "color": "amber",
      "staleness": {
        "asof": "2026-06-23",
        "lag_desc": "EOD delayed",
        "is_stale": false
      },
      "history": [
        {
          "date": "2026-06-17",
          "value": 13.8
        },
        {
          "date": "2026-06-18",
          "value": 13.5
        },
        {
          "date": "2026-06-19",
          "value": 13.9
        },
        {
          "date": "2026-06-20",
          "value": 14.4
        },
        {
          "date": "2026-06-23",
          "value": 18.6
        }
      ],
      "is_front_screen": true,
      "note": "prices insurance, orthogonal to SPX level"
    },
    {
      "key": "ust_2y",
      "axis": 2,
      "label": "UST 2Y",
      "source": "fred:DGS2",
      "value": 3.85,
      "change": -0.04,
      "transform": "first_diff",
      "ewma_z": -1.675472,
      "pct_1y": 100.0,
      "pct_3y": 100.0,
      "level_pct_756": 20.0,
      "robust_z": -1.180375,
      "color": "green",
      "staleness": {
        "asof": "2026-06-23",
        "lag_desc": "FRED daily",
        "is_stale": false
      },
      "history": [
        {
          "date": "2026-06-17",
          "value": 3.88
        },
        {
          "date": "2026-06-18",
          "value": 3.9
        },
        {
          "date": "2026-06-19",
          "value": 3.91
        },
        {
          "date": "2026-06-20",
          "value": 3.89
        },
        {
          "date": "2026-06-23",
          "value": 3.85
        }
      ],
      "is_front_screen": true,
      "note": null
    },
    {
      "key": "real_10y",
      "axis": 3,
      "label": "10Y Real (DFII10)",
      "source": "fred:DFII10",
      "value": 1.94,
      "change": -0.02,
      "transform": "first_diff",
      "ewma_z": -1.569925,
      "pct_1y": 100.0,
      "pct_3y": 100.0,
      "level_pct_756": 20.0,
      "robust_z": -1.349,
      "color": "green",
      "staleness": {
        "asof": "2026-06-23",
        "lag_desc": "FRED daily",
        "is_stale": false
      },
      "history": [
        {
          "date": "2026-06-17",
          "value": 1.95
        },
        {
          "date": "2026-06-18",
          "value": 1.96
        },
        {
          "date": "2026-06-19",
          "value": 1.97
        },
        {
          "date": "2026-06-20",
          "value": 1.96
        },
        {
          "date": "2026-06-23",
          "value": 1.94
        }
      ],
      "is_front_screen": true,
      "note": null
    },
    {
      "key": "breakeven_10y",
      "axis": 3,
      "label": "10Y Breakeven (T10YIE)",
      "source": "fred:T10YIE",
      "value": 2.33,
      "change": 0.01,
      "transform": "first_diff",
      "ewma_z": 1.165667,
      "pct_1y": 75.0,
      "pct_3y": 75.0,
      "level_pct_756": 100.0,
      "robust_z": 0.6745,
      "color": "green",
      "staleness": {
        "asof": "2026-06-23",